{"schema_version":1,"host":"claude","package_digest":"sha256:cac8d740d4774b7320ccd511e1a537797d594c8b35bfe8abec584f2b697519e3","assignment_digest":"sha256:b7db4adf554a8b63fb0e90093993b75f0c95ee4759afbac7753ca990f9458622","slot_id":"slot-2","requester_id":"requester-elevated","task_agent_id":"task-agent-elevated","judge_instance_id":"e-judge-instance-2","launch":{"owner":"host","host_task_id_digest":"sha256:bbbbbbbbbbbbbbbbbbbbbbbbbbbbbbbbbbbbbbbbbbbbbbbbbbbbbbbbbbbbbbbb","model_id":"claude-opus","reasoning_effort":"high","clean_context":true,"occurred_at":"2026-08-23T08:00:00Z"},"result":{"status":"completed","host_task_id_digest":"sha256:bbbbbbbbbbbbbbbbbbbbbbbbbbbbbbbbbbbbbbbbbbbbbbbbbbbbbbbbbbbbbbbb","verdict_locator":"judge/verdict-elevated-pass-b.json","verdict_digest":"sha256:a424227e5af42247a3a785546ae679448c281766ea976d7200eb03fcc97f248b","findings":[],"occurred_at":"2026-08-23T08:01:00Z"},"completion_authority":false}
